{
  "id": "persona-weng-shou-cheng-goldensea787",
  "type": "persona",
  "name": "GOLDENSEA787",
  "status": "needs_corroboration",
  "confidence": "confirmed",
  "attribution": {
    "status": "charged-allegation",
    "legal_posture": "The indictment explicitly reports this alias or moniker for a named defendant; the persona record leaves account-holder identity unassigned.",
    "as_of": "2026-10-18",
    "source_ids": [
      "doj-2026-10-13-ohio-indictment"
    ]
  },
  "caveats": [
    "The indictment states an allegation; guilt remains unadjudicated.",
    "Contact selectors, addresses, identity documents, and victim details are excluded."
  ],
  "identity_boundary": "Source-bounded persona record for GOLDENSEA787; keep it separate from any other person or account sharing the name or identifier.",
  "sources": [
    {
      "source_id": "doj-2026-10-13-ohio-indictment",
      "support": "The DOJ indictment reports GOLDENSEA787 in the described scheme.",
      "locator": "PDF p. 7 ¶20"
    }
  ],
  "claims": [
    {
      "id": "claim-persona-weng-shou-cheng-goldensea787",
      "type": "alias",
      "predicate": "source_reported_moniker",
      "value": {
        "persona": "GOLDENSEA787",
        "source_reported_for": "WENG SHOU CHENG, also known by the online monikers “GOLDENSEA787,” “GOLDENCENTAUR55,” and “GOLDLINE 3,”"
      },
      "confidence": "confirmed",
      "status": "needs_corroboration",
      "observed_at": "2026-10-18",
      "sources": [
        {
          "source_id": "doj-2026-10-13-ohio-indictment",
          "locator": "PDF p. 7 ¶20",
          "quote": "WENG SHOU CHENG, also known by the online monikers “GOLDENSEA787,” “GOLDENCENTAUR55,” and “GOLDLINE 3,” was a Chinese citizen residing in China."
        }
      ]
    }
  ],
  "last_verified_at": "2026-10-18"
}
