{
  "id": "front-company-yanbian-silverstar-network-technology-co-ltd",
  "type": "front_company",
  "name": "Yanbian Silverstar Network Technology Co., Ltd.",
  "status": "published",
  "confidence": "high",
  "attribution": {
    "status": "charged-allegation",
    "legal_posture": "current OFAC exact-ID address data adds only coarse Yanji, Jilin, China listing context; DPRK front company in China; The existing charging-stage allegation posture is unchanged",
    "as_of": "2026-08-16",
    "source_ids": [
      "doar9-ofac-alt-current",
      "doar9-ofac-sdn-current",
      "gov-658a689dd76a",
      "gov-e31464a55e89",
      "gov-f9a72a1e535b"
    ]
  },
  "locations": [
    "Yanji, Jilin, China (OFAC listing context)"
  ],
  "ttps": [
    "front-company presentation",
    "resume credibility and/or worker deployment"
  ],
  "caveats": [
    "Administrative sanctions state an administrative status; criminal charges and convictions require separate proceedings.",
    "Administrative sanctions listing; the record carries no criminal conviction.",
    "CHINA SILVER STAR INTERNET TECHNOLOGY COMPANY — official sanctions-list organization-name alias.",
    "The source supplies its recorded transliterations; an alias transfers to a same-name person or entity only when the source explicitly links it.",
    "Exact-ID merge only: each retained value is explicitly attached by the cited official dataset to the same sanctions-list entry; values stay attached to that entry pending a source bridge to any same-name subject.",
    "Sanctions-list address context records designation-era information; present physical location, current operations, ownership and control require separate evidence.",
    "SDN.CSV and ADD.CSV are component tables of one current OFAC dataset; together they form one corroboration source.",
    "SDN.CSV and ALT.CSV are component tables of one OFAC Sanctions List Service dataset/source family; count them as one source family.",
    "SILVER STAR INTERNET TECHNOLOGY CORPORATION — official sanctions-list organization-name alias.",
    "Street and postal addresses, birth data, passports, government and company identifiers, financial selectors, and sanctions boilerplate are excluded.",
    "The OFAC address table records designation data; the organization's charging-stage allegations belong to the separate case record.",
    "The source characterizes this organization in charging-stage allegations; the label remains an allegation rather than an adjudicated organizational finding.",
    "YANBIAN SILVER STAR — official sanctions-list organization-name alias."
  ],
  "aliases": [
    {
      "alias_type": "alternate-spelling",
      "relationship": "explicitly-used",
      "source_ids": [
        "gov-658a689dd76a",
        "gov-f9a72a1e535b"
      ],
      "value": "Yanji Silver Star Network Technology Co. Ltd."
    },
    {
      "alias_type": "organization-name",
      "relationship": "explicitly-used",
      "source_ids": [
        "doar9-ofac-alt-current"
      ],
      "value": "CHINA SILVER STAR INTERNET TECHNOLOGY COMPANY"
    },
    {
      "alias_type": "organization-name",
      "relationship": "explicitly-used",
      "source_ids": [
        "doar9-ofac-alt-current"
      ],
      "value": "SILVER STAR INTERNET TECHNOLOGY CORPORATION"
    },
    {
      "alias_type": "organization-name",
      "relationship": "explicitly-used",
      "source_ids": [
        "doar9-ofac-alt-current"
      ],
      "value": "YANBIAN SILVER STAR"
    },
    {
      "alias_type": "unknown",
      "relationship": "explicitly-used",
      "source_ids": [
        "gov-658a689dd76a",
        "gov-f9a72a1e535b"
      ],
      "value": "China Silver Star"
    },
    {
      "alias_type": "unknown",
      "relationship": "explicitly-used",
      "source_ids": [
        "gov-658a689dd76a",
        "gov-f9a72a1e535b"
      ],
      "value": "Silver Star China"
    },
    {
      "alias_type": "unknown",
      "relationship": "explicitly-used",
      "source_ids": [
        "gov-658a689dd76a",
        "gov-f9a72a1e535b"
      ],
      "value": "Unsong Internet Technology Corporation"
    },
    {
      "alias_type": "unknown",
      "relationship": "explicitly-used",
      "source_ids": [
        "gov-658a689dd76a",
        "gov-f9a72a1e535b"
      ],
      "value": "Yanbian Silverstar"
    }
  ],
  "lazarus_group_routes": [
    "front-company-yanbian-silverstar-network-technology-co-ltd"
  ],
  "sources": [
    {
      "source_id": "gov-658a689dd76a",
      "support": "RFJ names 14 workers, managers, and support staff, identifies their roles, and says the companies employed more than 130 DPRK IT workers",
      "locator": "Named-person list, associated organizations, poster images"
    },
    {
      "source_id": "gov-e31464a55e89",
      "support": "The current exact-ID ADD rows supply coarse Yanji, Jilin, China listing context for Yanbian Silverstar Network Technology Co., Ltd. Street, postal, company-identifier, and duplicate-row details are excluded",
      "locator": "ADD.CSV current row(s) joined to OFAC entity number 24977"
    },
    {
      "source_id": "doar9-ofac-alt-current",
      "support": "ALT.CSV supplies the retained source-explicit alias value(s) for OFAC ent_num 24977: YANBIAN SILVER STAR; SILVER STAR INTERNET TECHNOLOGY CORPORATION; CHINA SILVER STAR INTERNET TECHNOLOGY COMPANY. ALT.CSV is one component table of the OFAC Sanctions List Service dataset, not independent corroboration of SDN.CSV",
      "locator": "ALT.CSV alias row(s) joined to SDN.CSV by OFAC ent_num 24977"
    },
    {
      "source_id": "doar9-ofac-sdn-current",
      "support": "SDN.CSV supplies the current primary sanctions-list row and ent_num 24977 used to bind the entry to ALT.CSV. It does not supply any retained alias value in this record. SDN.CSV is one component table of the OFAC Sanctions List Service dataset, not independent corroboration of ALT.CSV",
      "locator": "SDN.CSV primary/current-list row for OFAC ent_num 24977"
    },
    {
      "source_id": "gov-f9a72a1e535b",
      "support": "Fourteen DPRK nationals affiliated with Yanbian Silverstar and Volasys Silverstar allegedly used stolen identities, front-company websites, laptop farms, money-transfer accounts, and extortion",
      "locator": "Press release — allegations, named subjects, organizations, and scheme summary"
    }
  ],
  "claims": [],
  "last_verified_at": "2026-10-18"
}
